{
  "v": "0.1",
  "session": "sess-slice-a003",
  "core": {
    "agent": "did:example:alice-phone#core",
    "kid": "did:example:alice-phone#core-key"
  },
  "runtime_profile": "R1",
  "hops": [
    {
      "peer": "did:example:alice-thermostat",
      "profile": "C0"
    }
  ],
  "egress": [
    {
      "id": "egress-0003",
      "provider": "did:example:search.example.net",
      "provider_profile": "P1",
      "payload_digest": {
        "alg": "sha-256",
        "value": "yXgR5Ddf2m60tGaT0gdS5tWEpOyKeRCiXFLwmYjC1Ms"
      },
      "report": {
        "id": "report-0003",
        "payload_digest": {
          "alg": "sha-256",
          "value": "yXgR5Ddf2m60tGaT0gdS5tWEpOyKeRCiXFLwmYjC1Ms"
        }
      }
    }
  ],
  "tier_display": {
    "session": "sess-slice-a003",
    "tier": 0,
    "shows": [
      "R1",
      "C0",
      "P1"
    ],
    "labels": [
      "legacy",
      "unattested"
    ],
    "rendered_at": "2026-10-09T08:10:00Z",
    "sig": {
      "alg": "EdDSA",
      "kid": "did:example:alice-phone#core-key",
      "canon": "jcs",
      "value": "EXAMPLE-NOT-A-REAL-SIGNATURE-c2lnbmF0dXJlLXBsYWNlaG9sZGVy",
      "signer": "did:example:alice-phone#core"
    }
  }
}
